{
  "protocol_version": "codeattest.v0",
  "event_id": "sha256:aa8676e1b67d0ebcd595c9762eb5f166acc45d5a08fa7e174ad881f6ff5bb092",
  "review_id": "review:synthetic-demo-001",
  "sequence_number": 0,
  "idempotency_key": "verification_evidence:review:synthetic-demo-001:verification_evidence:synthetic_validation_evidence:record_version:1",
  "event_type": "verification_evidence_recorded",
  "actor": {
    "actor_type": "customer_user",
    "actor_id": "customer:synthetic-maya"
  },
  "event_timestamp": "2026-07-30T12:00:00Z",
  "artifact_refs": [
    "artifact_ref:synthetic_validation_evidence"
  ],
  "visibility": "customer_facing",
  "canonicalization": "rfc8785",
  "identity_hash_algorithm": "sha256",
  "identity_input_excludes": [
    "event_id"
  ],
  "source_derived_class": "retained_review_artifact",
  "reason": "SYNTHETIC_DEMO_DATA verification evidence metadata recorded. NOT_CUSTOMER_SOURCE."
}
