{
  "protocol_version": "codeattest.v0",
  "event_id": "sha256:100aedaed24f8bf4c8a34d08a10dbb2c5a88237b851befeab4c6f52cd67d784b",
  "review_id": "review:synthetic-demo-001",
  "sequence_number": 1,
  "idempotency_key": "verification_record:review:synthetic-demo-001:verification_record:synthetic_pending:record_version:1",
  "event_type": "verification_recorded",
  "actor": {
    "actor_type": "reviewer",
    "actor_id": "reviewer:synthetic-amelia"
  },
  "event_timestamp": "2026-07-31T12:00:00Z",
  "artifact_refs": [
    "artifact_ref:synthetic_pending"
  ],
  "visibility": "customer_facing",
  "canonicalization": "rfc8785",
  "identity_hash_algorithm": "sha256",
  "identity_input_excludes": [
    "event_id"
  ],
  "source_derived_class": "retained_review_artifact",
  "reason": "SYNTHETIC_DEMO_DATA reviewer verification decision recorded. NOT_CUSTOMER_SOURCE."
}
