{
  "protocol_version": "codeattest.v0",
  "event_id": "sha256:f5176c0cd3858f0e2da4308cb52a17e61ff65d37cf392caf39f3274c124e6ab4",
  "review_id": "review:synthetic-demo-001",
  "sequence_number": 1,
  "idempotency_key": "classification:review:synthetic-demo-001:classification_record:finding_001",
  "event_type": "classification_recorded",
  "actor": {
    "actor_type": "reviewer",
    "actor_id": "SYNTHETIC_DEMO_DATA-reviewer-1"
  },
  "event_timestamp": "2026-07-19T00:00:00Z",
  "artifact_refs": [
    "artifact_ref:finding_001"
  ],
  "visibility": "internal_only",
  "canonicalization": "rfc8785",
  "identity_hash_algorithm": "sha256",
  "identity_input_excludes": [
    "event_id"
  ],
  "internal_note": "NOT_CUSTOMER_SOURCE reviewer classification rationale"
}
