{
  "protocol_version": "codeattest.v0",
  "event_id": "sha256:239b41d6c7629c8dee8ba0be7061412105c40bbeb1c2372e91c70ba85f258515",
  "review_id": "review:synthetic-demo-001",
  "sequence_number": 6,
  "idempotency_key": "verification_scope:review:synthetic-demo-001:verification_pass:synthetic_pass_requires_validation_001:scope_version:1",
  "event_type": "verification_scope_recorded",
  "actor": {
    "actor_type": "customer_user",
    "actor_id": "customer:synthetic-maya"
  },
  "event_timestamp": "2026-07-29T12:00:00Z",
  "artifact_refs": [
    "artifact_ref:synthetic_pass_requires_validation_001"
  ],
  "visibility": "customer_facing",
  "canonicalization": "rfc8785",
  "identity_hash_algorithm": "sha256",
  "identity_input_excludes": [
    "event_id"
  ],
  "reason": "SYNTHETIC_DEMO_DATA verification-pass scope recorded for customer-selected findings only. NOT_CUSTOMER_SOURCE."
}
